{
  "step": "f3_sit_step_4",
  "tema_id": "gioco-libero-come-incontro-del-bambino-con-il-possibile",
  "domain_selected": "clinico",
  "results": [
    {
      "methodological_status": "validato",
      "source_validations": {
        "f3_coherence_status": null,
        "step_3_executed": true
      },
      "item_checks": [
        {
          "item_ref": "F3-SIT-001",
          "source_step": "f3_sit_step_2",
          "family_id": "F3-SIT-1",
          "checks": [
            { "id": "C1", "outcome": "passa", "motivation": "Vieta esplicitamente letture come 'e timido' o 'poco interattivo' e tratta il vuoto come stato del campo, non come tratto del bambino." },
            { "id": "C2", "outcome": "passa", "motivation": "Non chiama in causa il caregiver ne gli attribuisce la mancata attivazione del bambino." },
            { "id": "C3", "outcome": "passa", "motivation": "Nessuna moralizzazione: la non-azione non e giudicata in termini di merito o colpa, ne per il bambino ne per terzi." },
            { "id": "C4", "outcome": "passa", "motivation": "Resta micro-mediazione: dichiara di non indicare cosa fare per 'attivare' il bambino e sostiene il vuoto senza procedura." },
            { "id": "C5", "outcome": "passa", "motivation": "Agisce sul campo (sostenere il vuoto, presenza discreta, non accorciare il segmento) e non corregge direttamente il soggetto." },
            { "id": "C6", "outcome": "passa", "motivation": "Tracciabile a nodo 'campo-desiderabile' e funzione 'proteggere'; configurational_basis presente e coerente (source_device_id null non richiesto da C6)." },
            { "id": "C7", "outcome": "passa", "motivation": "Utile in formazione: mostra una configurazione riconoscibile senza diventare ricetta di attivazione." },
            { "id": "C8", "outcome": "passa", "motivation": "Mantiene aperta l'osservabilita: rende leggibile la differenza tra apertura formale e apertura abitata senza chiuderla in un indice." }
          ],
          "item_verdict": "validato",
          "critical_failures": []
        },
        {
          "item_ref": "F3-SIT-002",
          "source_step": "f3_sit_step_2",
          "family_id": "F3-SIT-1",
          "checks": [
            { "id": "C1", "outcome": "passa", "motivation": "Non etichetta il bambino come 'collaborante e orientato', anzi vieta di registrare come positiva un'osservazione costruita dalla pressione del caregiver." },
            { "id": "C2", "outcome": "passa", "motivation": "Riconosce la ricaduta del caregiver ma vieta esplicitamente di colpevolizzarlo o rimproverarlo davanti al bambino." },
            { "id": "C3", "outcome": "passa", "motivation": "Nessuna moralizzazione del bambino ne del genitore: la pressione prestazionale e letta come vettore, non come colpa." },
            { "id": "C4", "outcome": "passa", "motivation": "Non prescrive di 'zittire' il caregiver: indica un gesto situato e reversibile, non un protocollo." },
            { "id": "C5", "outcome": "passa", "motivation": "Ri-protegge la condizione lateralmente con un segnale discreto sul campo, senza correggere il bambino." },
            { "id": "C6", "outcome": "passa", "motivation": "Nodo 'campo-desiderabile' e funzione 'proteggere' presenti e coerenti con il target field dichiarato." },
            { "id": "C7", "outcome": "passa", "motivation": "Adatto alla formazione: insegna a separare il segnale del nodo dalla sua cattura senza fornire una formula." },
            { "id": "C8", "outcome": "passa", "motivation": "Rende nuovamente osservabile quanto l'orientamento sia genuino e quanto gia rivolto al riconoscimento dell'adulto." }
          ],
          "item_verdict": "validato",
          "critical_failures": []
        },
        {
          "item_ref": "F3-SIT-003",
          "source_step": "f3_sit_step_2",
          "family_id": "F3-SIT-1",
          "checks": [
            { "id": "C1", "outcome": "passa", "motivation": "Vieta di concludere che l'esito 'piatto' sia informazione sul bambino: imputa il restringimento al gesto adulto, non al soggetto." },
            { "id": "C2", "outcome": "passa", "motivation": "Il fallimento e collocato sul lato del pediatra (qualita performativa), non a carico del caregiver." },
            { "id": "C3", "outcome": "passa", "motivation": "Nessun giudizio morale sul bambino o su terzi; si discute solo il 'come' del gesto adulto." },
            { "id": "C4", "outcome": "passa", "motivation": "Non aggiunge un passo procedurale e dichiara che il 'come' non e riducibile a checklist: resta micro-mediazione." },
            { "id": "C5", "outcome": "passa", "motivation": "Interviene sulla qualita del campo (tono, postura, timing) e non sulla condotta del bambino." },
            { "id": "C6", "outcome": "passa", "motivation": "Tracciabile a 'campo-desiderabile'/'proteggere'; il breaking point dichiarato riguarda il dispositivo, non la coerenza dei campi." },
            { "id": "C7", "outcome": "passa", "motivation": "Formativamente prezioso: mostra che la forma piena puo coesistere con un campo chiudente, senza codificare la voce giusta." },
            { "id": "C8", "outcome": "passa", "motivation": "Apre l'osservabilita del 'come', livello che il dispositivo non marca: rende percepibile la differenza tra apertura e rituale." }
          ],
          "item_verdict": "validato",
          "critical_failures": []
        },
        {
          "item_ref": "F3-SIT-004",
          "source_step": "f3_sit_step_2",
          "family_id": "F3-SIT-1",
          "checks": [
            { "id": "C1", "outcome": "passa", "motivation": "Vieta di attribuire al bambino la discontinuita prodotta dagli eventi di setting: nessuna etichetta sul soggetto." },
            { "id": "C2", "outcome": "passa", "motivation": "Il commento del caregiver e uno degli eventi di setting, non oggetto di colpevolizzazione." },
            { "id": "C3", "outcome": "passa", "motivation": "Nessuna moralizzazione: l'oscillazione e trattata come informazione strutturale, non come condotta da giudicare." },
            { "id": "C4", "outcome": "passa", "motivation": "Non fissa soglie di aggregazione ne regole di computo: la lettura sintetica resta giudizio situato." },
            { "id": "C5", "outcome": "passa", "motivation": "Protegge la continuita del segmento agendo sul setting, senza forzare il bambino ne la durata." },
            { "id": "C6", "outcome": "passa", "motivation": "Nodo 'campo-desiderabile' e funzione 'proteggere' presenti e coerenti con il target field." },
            { "id": "C7", "outcome": "passa", "motivation": "Adatto alla formazione: insegna a leggere l'oscillazione come qualita del campo senza fornire una regola di soglia." },
            { "id": "C8", "outcome": "passa", "motivation": "Rende osservabile la frammentazione come stato del campo, distinguendola da una caratteristica del bambino." }
          ],
          "item_verdict": "validato",
          "critical_failures": []
        },
        {
          "item_ref": "F3-SIT-005",
          "source_step": "f3_sit_step_2",
          "family_id": "F3-SIT-1",
          "checks": [
            { "id": "C1", "outcome": "passa", "motivation": "Vieta sia il giudizio positivo per tappe sia lo 'smascheramento' del bambino: nessuna classificazione del soggetto." },
            { "id": "C2", "outcome": "passa", "motivation": "La preparazione familiare e contestualizzata come pressione internalizzata, non come colpa del caregiver." },
            { "id": "C3", "outcome": "passa", "motivation": "Nessuna moralizzazione: la prestazionalita e letta configurazionalmente, non giudicata." },
            { "id": "C4", "outcome": "passa", "motivation": "Non fornisce un test per smascherare il bambino: in caso di dubbio prescrive di dichiarare l'esito ambiguo, non una procedura." },
            { "id": "C5", "outcome": "passa", "motivation": "Sposta l'osservazione dal lato esterno al lato interno del campo, senza correggere il bambino." },
            { "id": "C6", "outcome": "passa", "motivation": "Tracciabile a 'campo-desiderabile'/'proteggere'; il falso positivo dichiarato e limite del dispositivo, non incoerenza dei campi." },
            { "id": "C7", "outcome": "passa", "motivation": "Formativamente utile: distingue orientamento agli oggetti da orientamento all'immagine-di-se senza dare una checklist." },
            { "id": "C8", "outcome": "passa", "motivation": "Apre una nuova osservabilita (tempi morti, errori, ridirezioni) che eccede il singolo segmento." }
          ],
          "item_verdict": "validato",
          "critical_failures": []
        },
        {
          "item_ref": "F3-SIT-006",
          "source_step": "f3_sit_step_2",
          "family_id": "F3-SIT-2",
          "checks": [
            { "id": "C1", "outcome": "passa", "motivation": "L'item riguarda l'annuncio dell'intervallo e non formula alcuna classificazione del bambino." },
            { "id": "C2", "outcome": "passa", "motivation": "Si rivolge a bambino e caregiver come destinatari del segnale, senza attribuire colpe al genitore." },
            { "id": "C3", "outcome": "passa", "motivation": "Nessuna moralizzazione: la frase e un segnale di campo, non un giudizio su nessuno." },
            { "id": "C4", "outcome": "passa", "motivation": "Dichiara la formula come esempio e non copione: conta la densita ordinaria, non le parole esatte." },
            { "id": "C5", "outcome": "passa", "motivation": "Agisce sulla qualita del campo (annuncio come segnale e non evento) senza dirigere il bambino." },
            { "id": "C6", "outcome": "passa", "motivation": "Nodo 'campo-desiderabile' e funzione 'proteggere' presenti e coerenti con il target field." },
            { "id": "C7", "outcome": "passa", "motivation": "Adatto all'uso formativo: la possible_phrase e esemplificativa e accompagnata da warning sul tono." },